{
  "request_id": "req_meta_fixture_1",
  "provider": "meta",
  "operation": "message.webhook",
  "direction": "inbound",
  "channel": "instagram",
  "occurred_at": "2026-09-27T00:00:00.000Z",
  "payload": {
    "object": "instagram",
    "entry": []
  },
  "legacy_contract": {
    "source": "legacy-meta-webhook",
    "fixture_name": "meta_message_webhook_minimal"
  }
}
